{
  "schema_version": "2.0",
  "report_id": "R002",
  "generated_date": "2025-12-18",
  "generated_timestamp": "2025-12-18T23:32:10.307592",
  "client": "BFAI",
  "benchmark": {
    "version": "1.3",
    "type": "cloud",
    "file": "benchmark_BFAI_v1.3__cloud__2025-12-18.json",
    "date": "2025-12-18"
  },
  "test": {
    "run_id": "R002",
    "type": "cloud",
    "file": "results_p12_cloud.json",
    "timestamp": "2025-12-18T23:31:55.106336"
  },
  "config_match": {
    "all_matched": false,
    "parameters": {
      "model": {
        "benchmark": "gemini-3-flash-preview",
        "test": "cloud",
        "match": false
      },
      "reasoning_effort": {
        "benchmark": "low",
        "test": null,
        "match": false
      },
      "temperature": {
        "benchmark": 0.0,
        "test": 0.0,
        "match": true
      },
      "recall_top_k": {
        "benchmark": 100,
        "test": 100,
        "match": true
      },
      "precision_top_n": {
        "benchmark": 25,
        "test": 12,
        "match": false
      }
    }
  },
  "comparison": {
    "metrics": {
      "pass_rate": {
        "benchmark": 0.9258,
        "test": 0.8624,
        "delta": -0.0633,
        "delta_pct": -6.33,
        "status": "regression"
      },
      "partial_rate": {
        "benchmark": 0.0655,
        "test": 0.1026,
        "delta": 0.0371,
        "delta_pct": 3.71,
        "status": "improvement"
      },
      "fail_rate": {
        "benchmark": 0.0087,
        "test": 0.0349,
        "delta": 0.0262,
        "delta_pct": 2.62,
        "status": "regression"
      },
      "acceptable_rate": {
        "benchmark": 0.9913,
        "test": 0.9651,
        "delta": -0.0262,
        "delta_pct": -2.62,
        "status": "regression"
      },
      "recall_at_100": {
        "benchmark": 0.9913,
        "test": 0.9913,
        "delta": 0.0,
        "delta_pct": 0.0,
        "status": "match"
      },
      "mrr": {
        "benchmark": 0.7407,
        "test": 0.7408,
        "delta": 0.0,
        "delta_pct": 0.0,
        "status": "match"
      },
      "overall_score_avg": {
        "benchmark": 4.8192,
        "test": 4.6552,
        "delta": -0.164,
        "delta_pct": -16.4,
        "status": "regression"
      }
    },
    "latency": {
      "total": {
        "benchmark": 9.4,
        "test": 7.4,
        "delta": -2.0,
        "speedup": 1.27
      },
      "client_experience": {
        "benchmark": 8.14,
        "test": 6.2,
        "delta": -1.94,
        "speedup": 1.31
      }
    },
    "cost": {
      "total": {
        "benchmark": 0.4968,
        "test": 0.0,
        "delta": -0.4968
      },
      "per_question": {
        "benchmark": 0.001085,
        "test": 0.0,
        "delta": -0.001085
      }
    },
    "breakdown_by_type": {
      "single_hop": {
        "benchmark_pass_rate": 0.9414,
        "test_pass_rate": 0.9054,
        "delta": -0.036,
        "benchmark_counts": {
          "pass": 209,
          "partial": 9,
          "fail": 4
        },
        "test_counts": {
          "pass": 201,
          "partial": 12,
          "fail": 9
        }
      },
      "multi_hop": {
        "benchmark_pass_rate": 0.911,
        "test_pass_rate": 0.822,
        "delta": -0.089,
        "benchmark_counts": {
          "pass": 215,
          "partial": 21,
          "fail": 0
        },
        "test_counts": {
          "pass": 194,
          "partial": 35,
          "fail": 7
        }
      }
    },
    "breakdown_by_difficulty": {
      "easy": {
        "benchmark_pass_rate": 0.8944,
        "test_pass_rate": 0.8385,
        "delta": -0.0559,
        "benchmark_counts": {
          "pass": 144,
          "partial": 14,
          "fail": 3
        },
        "test_counts": {
          "pass": 135,
          "partial": 16,
          "fail": 10
        }
      },
      "medium": {
        "benchmark_pass_rate": 0.9503,
        "test_pass_rate": 0.9255,
        "delta": -0.0248,
        "benchmark_counts": {
          "pass": 153,
          "partial": 8,
          "fail": 0
        },
        "test_counts": {
          "pass": 149,
          "partial": 11,
          "fail": 1
        }
      },
      "hard": {
        "benchmark_pass_rate": 0.9338,
        "test_pass_rate": 0.8162,
        "delta": -0.1176,
        "benchmark_counts": {
          "pass": 127,
          "partial": 8,
          "fail": 1
        },
        "test_counts": {
          "pass": 111,
          "partial": 20,
          "fail": 5
        }
      }
    }
  },
  "summary": {
    "verdict": "FAIL",
    "regressions": [
      "pass_rate",
      "fail_rate",
      "acceptable_rate",
      "overall_score_avg"
    ],
    "improvements": [
      "partial_rate",
      "latency"
    ],
    "key_finding": "Significant regressions in: pass_rate, fail_rate, acceptable_rate, overall_score_avg",
    "recommendation": "Do not deploy. Investigate and fix regressions."
  },
  "failures": {
    "benchmark_only": [],
    "test_only": [
      "mh_easy_020",
      "mh_easy_038",
      "mh_easy_065",
      "mh_hard_020",
      "mh_hard_026",
      "mh_hard_066",
      "mh_med_064",
      "sh_easy_003",
      "sh_easy_068",
      "sh_easy_069",
      "sh_easy_083",
      "sh_hard_023"
    ],
    "both": [
      "sh_easy_021",
      "sh_easy_066",
      "sh_easy_079",
      "sh_hard_020"
    ],
    "benchmark_count": 4,
    "test_count": 16
  },
  "files": {
    "benchmark_json": "/Users/scottmacon/Documents/GitHub/ragas/benchmarks/BFAI/benchmark_BFAI_v1.3__cloud__2025-12-18.json",
    "test_json": "reports/gold_standard_eval/results_p12_cloud.json",
    "report_json": "/Users/scottmacon/Documents/GitHub/ragas/reports/gold_standard_eval/report_BFAI__R002__2025-12-18.json",
    "report_markdown": "/Users/scottmacon/Documents/GitHub/ragas/reports/gold_standard_eval/final_reports/R002_Benchmark_Report_2025-12-18.md"
  }
}